id,target,sdg,text,sentence,word_types,nouns,verbs,adjectives
T71G8,"By 2020, develop and operationalize a global strategy for youth employment and implement the Global Jobs Pact of the International Labour Organization",Decent Work and Economic Growth,decent work and economic growth by  develop and operationalize a global strategy for youth employment and implement the global jobs pact of the international labour organization,"['decent', 'work', 'economic', 'growth', 'develop', 'global', 'strategy', 'youth', 'employment', 'global', 'pact', 'international', 'labour', 'organization']","['JJ', 'NN', 'JJ', 'NN', 'NN', 'JJ', 'NN', 'JJ', 'NN', 'JJ', 'NN', 'JJ', 'NN', 'NN']",8,0,6
T72G9,"Develop quality, reliable, sustainable and resilient infrastructure, including regional and transborder infrastructure, to support economic development and human well-being, with a focus on affordable and equitable access for all","Industry, Innovation and Infrastructure",industry innovation and infrastructure develop quality reliable sustainable and resilient infrastructure including regional and transborder infrastructure to support economic development and human wellbeing with a focus on affordable and equitable access for all,"['industry', 'innovation', 'infrastructure', 'develop', 'quality', 'reliable', 'sustainable', 'resilient', 'infrastructure', 'regional', 'transborder', 'infrastructure', 'economic', 'development', 'human', 'focus', 'affordable', 'equitable', 'access']","['NN', 'NN', 'NN', 'VBP', 'NN', 'JJ', 'JJ', 'JJ', 'NN', 'JJ', 'JJ', 'NN', 'JJ', 'NN', 'JJ', 'NN', 'JJ', 'JJ', 'NN']",9,1,9
T73G9,"Promote inclusive and sustainable industrialization and, by 2030, significantly raise industry’s share of employment and gross domestic product, in line with national circumstances, and double its share in least developed countries","Industry, Innovation and Infrastructure",industry innovation and infrastructure promote inclusive and sustainable industrialization and by  significantly raise industry’s share of employment and gross domestic product in line with national circumstances and double its share in least developed countries,"['industry', 'innovation', 'infrastructure', 'promote', 'inclusive', 'sustainable', 'industrialization', 'industry', 'share', 'employment', 'gross', 'domestic', 'product', 'line', 'national', 'share', 'developed']","['NN', 'NN', 'NN', 'VBP', 'JJ', 'JJ', 'NN', 'NN', 'NN', 'NN', 'JJ', 'JJ', 'NN', 'NN', 'JJ', 'NN', 'JJ']",10,1,6
T74G9,"Increase the access of small-scale industrial and other enterprises, in particular in developing countries, to financial services, including affordable credit, and their integration into value chains and markets","Industry, Innovation and Infrastructure",industry innovation and infrastructure increase the access of smallscale industrial and other enterprises in particular in developing countries to financial services including affordable credit and their integration into value chains and markets,"['industry', 'innovation', 'infrastructure', 'increase', 'access', 'smallscale', 'industrial', 'other', 'particular', 'financial', 'affordable', 'credit', 'integration', 'value']","['NN', 'NN', 'NN', 'NN', 'NN', 'JJ', 'JJ', 'JJ', 'JJ', 'JJ', 'JJ', 'NN', 'NN', 'NN']",8,0,6
T75G9,"By 2030, upgrade infrastructure and retrofit industries to make them sustainable, with increased resource-use efficiency and greater adoption of clean and environmentally sound technologies and industrial processes, with all countries taking action in accordance with their respective capabilities","Industry, Innovation and Infrastructure",industry innovation and infrastructure by  upgrade infrastructure and retrofit industries to make them sustainable with increased resourceuse efficiency and greater adoption of clean and environmentally sound technologies and industrial processes with all countries taking action in accordance with their respective capabilities,"['industry', 'innovation', 'infrastructure', 'upgrade', 'infrastructure', 'retrofit', 'sustainable', 'increased', 'resourceuse', 'efficiency', 'adoption', 'clean', 'sound', 'industrial', 'action', 'accordance', 'respective']","['NN', 'NN', 'NN', 'JJ', 'NN', 'NN', 'JJ', 'JJ', 'NN', 'NN', 'NN', 'JJ', 'JJ', 'JJ', 'NN', 'NN', 'JJ']",10,0,7
T76G9,"Enhance scientific research, upgrade the technological capabilities of industrial sectors in all countries, in particular developing countries, including, by 2030, encouraging innovation and substantially increasing the number of research and development workers per 1 million people and public and private research and development spending","Industry, Innovation and Infrastructure",industry innovation and infrastructure enhance scientific research upgrade the technological capabilities of industrial sectors in all countries in particular developing countries including by  encouraging innovation and substantially increasing the number of research and development workers per  million people and public and private research and development spending,"['industry', 'innovation', 'infrastructure', 'enhance', 'scientific', 'research', 'technological', 'industrial', 'particular', 'innovation', 'number', 'research', 'development', 'public', 'private', 'research', 'development', 'spending']","['NN', 'NN', 'NN', 'NN', 'JJ', 'NN', 'JJ', 'JJ', 'JJ', 'NN', 'NN', 'NN', 'NN', 'JJ', 'JJ', 'NN', 'NN', 'NN']",12,0,6
T77G9,"Facilitate sustainable and resilient infrastructure development in developing countries through enhanced financial, technological and technical support to African countries, least developed countries, landlocked developing countries and small island developing States 18","Industry, Innovation and Infrastructure",industry innovation and infrastructure facilitate sustainable and resilient infrastructure development in developing countries through enhanced financial technological and technical support to african countries least developed countries landlocked developing countries and small island developing states ,"['industry', 'innovation', 'infrastructure', 'facilitate', 'sustainable', 'resilient', 'infrastructure', 'development', 'enhanced', 'financial', 'technological', 'technical', 'support', 'african', 'developed', 'small', 'island']","['NN', 'NN', 'NN', 'NN', 'JJ', 'JJ', 'NN', 'NN', 'JJ', 'JJ', 'JJ', 'JJ', 'NN', 'JJ', 'JJ', 'JJ', 'NN']",8,0,9
T78G9,"Support domestic technology development, research and innovation in developing countries, including by ensuring a conducive policy environment for, inter alia, industrial diversification and value addition to commodities","Industry, Innovation and Infrastructure",industry innovation and infrastructure support domestic technology development research and innovation in developing countries including by ensuring a conducive policy environment for inter alia industrial diversification and value addition to commodities,"['industry', 'innovation', 'infrastructure', 'support', 'domestic', 'technology', 'development', 'research', 'innovation', 'conducive', 'policy', 'environment', 'inter', 'alia', 'industrial', 'diversification', 'value', 'addition']","['NN', 'NN', 'NN', 'NN', 'JJ', 'NN', 'NN', 'NN', 'NN', 'JJ', 'NN', 'NN', 'NN', 'VBP', 'JJ', 'NN', 'NN', 'NN']",14,1,3
T79G9,Significantly increase access to information and communications technology and strive to provide universal and affordable access to the Internet in least developed countries by 2020,"Industry, Innovation and Infrastructure",industry innovation and infrastructure significantly increase access to information and communications technology and strive to provide universal and affordable access to the internet in least developed countries by ,"['industry', 'innovation', 'infrastructure', 'access', 'information', 'communications', 'technology', 'strive', 'universal', 'affordable', 'access', 'internet', 'developed']","['NN', 'NN', 'NN', 'NN', 'NN', 'NN', 'NN', 'JJ', 'JJ', 'JJ', 'NN', 'NN', 'JJ']",9,0,4
T80G10,"By 2030, progressively achieve and sustain income growth of the bottom 40 per cent of the population at a rate higher than the national average",Reduce Inequalities,reduce inequalities by  progressively achieve and sustain income growth of the bottom  per cent of the population at a rate higher than the national average,"['achieve', 'sustain', 'income', 'growth', 'bottom', 'cent', 'population', 'rate', 'national', 'average']","['JJ', 'JJ', 'NN', 'NN', 'JJ', 'NN', 'NN', 'NN', 'JJ', 'NN']",6,0,4
T81G10,"By 2030, empower and promote the social, economic and political inclusion of all, irrespective of age, sex, disability, race, ethnicity, origin, religion or economic or other status",Reduce Inequalities,reduce inequalities by  empower and promote the social economic and political inclusion of all irrespective of age sex disability race ethnicity origin religion or economic or other status,"['empower', 'social', 'economic', 'political', 'inclusion', 'irrespective', 'age', 'sex', 'disability', 'race', 'ethnicity', 'origin', 'religion', 'economic', 'other', 'status']","['NN', 'JJ', 'JJ', 'JJ', 'NN', 'NN', 'NN', 'NN', 'NN', 'NN', 'NN', 'VBP', 'NN', 'JJ', 'JJ', 'NN']",10,1,5
T82G10,"Ensure equal opportunity and reduce inequalities of outcome, including by eliminating discriminatory laws, policies and practices and promoting appropriate legislation, policies and action in this regard",Reduce Inequalities,reduce inequalities ensure equal opportunity and reduce inequalities of outcome including by eliminating discriminatory laws policies and practices and promoting appropriate legislation policies and action in this regard,"['equal', 'opportunity', 'outcome', 'discriminatory', 'appropriate', 'legislation', 'action', 'regard']","['JJ', 'NN', 'NN', 'JJ', 'JJ', 'NN', 'NN', 'NN']",5,0,3
T83G10,"Adopt policies, especially fiscal, wage and social protection policies, and progressively achieve greater equality",Reduce Inequalities,reduce inequalities adopt policies especially fiscal wage and social protection policies and progressively achieve greater equality,"['fiscal', 'wage', 'social', 'protection', 'achieve', 'equality']","['JJ', 'NN', 'JJ', 'NN', 'VBP', 'NN']",3,1,2
T84G10,Improve the regulation and monitoring of global financial markets and institutions and strengthen the implementation of such regulations,Reduce Inequalities,reduce inequalities improve the regulation and monitoring of global financial markets and institutions and strengthen the implementation of such regulations,"['regulation', 'monitoring', 'global', 'financial', 'implementation', 'such']","['NN', 'NN', 'JJ', 'JJ', 'NN', 'JJ']",3,0,3
T85G10,"Ensure enhanced representation and voice for developing countries in decision-making in global international economic and financial institutions in order to deliver more effective, credible, accountable and legitimate institutions",Reduce Inequalities,reduce inequalities ensure enhanced representation and voice for developing countries in decisionmaking in global international economic and financial institutions in order to deliver more effective credible accountable and legitimate institutions,"['representation', 'voice', 'global', 'international', 'economic', 'financial', 'order', 'effective', 'credible', 'accountable', 'legitimate']","['NN', 'NN', 'JJ', 'JJ', 'JJ', 'JJ', 'NN', 'JJ', 'JJ', 'JJ', 'JJ']",3,0,8
T86G10,"Facilitate orderly, safe, regular and responsible migration and mobility of people, including through the implementation of planned and well-managed migration policies",Reduce Inequalities,reduce inequalities facilitate orderly safe regular and responsible migration and mobility of people including through the implementation of planned and wellmanaged migration policies,"['facilitate', 'orderly', 'safe', 'regular', 'responsible', 'migration', 'mobility', 'implementation', 'migration']","['VBP', 'JJ', 'JJ', 'NN', 'JJ', 'NN', 'NN', 'NN', 'NN']",5,1,3
T87G10,"Implement the principle of special and differential treatment for developing countries, in particular least developed countries, in accordance with World Trade Organization agreements",Reduce Inequalities,reduce inequalities implement the principle of special and differential treatment for developing countries in particular least developed countries in accordance with world trade organization agreements,"['principle', 'special', 'differential', 'treatment', 'particular', 'developed', 'accordance', 'world', 'trade', 'organization']","['NN', 'JJ', 'JJ', 'NN', 'JJ', 'JJ', 'NN', 'NN', 'NN', 'NN']",6,0,4
T88G10,"Encourage official development assistance and financial flows, including foreign direct investment, to States where the need is greatest, in particular least developed countries, African countries, small island developing States and landlocked developing countries, in accordance with their national plans and programmes",Reduce Inequalities,reduce inequalities encourage official development assistance and financial flows including foreign direct investment to states where the need is greatest in particular least developed countries african countries small island developing states and landlocked developing countries in accordance with their national plans and programmes,"['official', 'development', 'assistance', 'financial', 'foreign', 'direct', 'investment', 'need', 'particular', 'developed', 'african', 'small', 'island', 'accordance', 'national']","['JJ', 'NN', 'NN', 'JJ', 'JJ', 'JJ', 'NN', 'NN', 'JJ', 'JJ', 'JJ', 'JJ', 'VBP', 'NN', 'JJ']",5,1,9
T89G10,"By 2030, reduce to less than 3 per cent the transaction costs of migrant remittances and eliminate remittance corridors with costs higher than 5 per cent",Reduce Inequalities,reduce inequalities by  reduce to less than  per cent the transaction costs of migrant remittances and eliminate remittance corridors with costs higher than  per cent,"['cent', 'transaction', 'migrant', 'remittance', 'cent']","['NN', 'NN', 'JJ', 'NN', 'NN']",4,0,1
T90G11,"By 2030, ensure access for all to adequate, safe and affordable housing and basic services and upgrade slums",Sustainable Cities and Communities,sustainable cities and communities by  ensure access for all to adequate safe and affordable housing and basic services and upgrade slums,"['sustainable', 'access', 'safe', 'affordable', 'housing', 'basic', 'upgrade']","['JJ', 'NN', 'JJ', 'JJ', 'NN', 'JJ', 'JJ']",2,0,5
T91G11,"By 2030, provide access to safe, affordable, accessible and sustainable transport systems for all, improving road safety, notably by expanding public transport, with special attention to the needs of those in vulnerable situations, women, children, persons with disabilities and older persons",Sustainable Cities and Communities,sustainable cities and communities by  provide access to safe affordable accessible and sustainable transport systems for all improving road safety notably by expanding public transport with special attention to the needs of those in vulnerable situations women children persons with disabilities and older persons,"['sustainable', 'provide', 'access', 'affordable', 'accessible', 'sustainable', 'transport', 'road', 'safety', 'public', 'transport', 'special', 'attention', 'vulnerable']","['JJ', 'JJ', 'NN', 'JJ', 'JJ', 'JJ', 'NN', 'NN', 'NN', 'JJ', 'NN', 'JJ', 'NN', 'JJ']",6,0,8
T92G11,"By 2030, enhance inclusive and sustainable urbanization and capacity for participatory, integrated and sustainable human settlement planning and management in all countries",Sustainable Cities and Communities,sustainable cities and communities by  enhance inclusive and sustainable urbanization and capacity for participatory integrated and sustainable human settlement planning and management in all countries,"['sustainable', 'enhance', 'inclusive', 'sustainable', 'urbanization', 'capacity', 'participatory', 'sustainable', 'human', 'settlement', 'planning', 'management']","['JJ', 'NN', 'NN', 'JJ', 'NN', 'NN', 'NN', 'JJ', 'JJ', 'NN', 'NN', 'NN']",8,0,4
T93G11,Strengthen efforts to protect and safeguard the world’s cultural and natural heritage,Sustainable Cities and Communities,sustainable cities and communities strengthen efforts to protect and safeguard the world’s cultural and natural heritage,"['sustainable', 'strengthen', 'world', 'cultural', 'natural', 'heritage']","['JJ', 'VBP', 'NN', 'JJ', 'JJ', 'NN']",2,1,3
T94G11,"By 2030, significantly reduce the number of deaths and the number of people affected and substantially decrease the direct economic losses relative to global gross domestic product caused by disasters, including water-related disasters, with a focus on protecting the poor and people in vulnerable situations",Sustainable Cities and Communities,sustainable cities and communities by  significantly reduce the number of deaths and the number of people affected and substantially decrease the direct economic losses relative to global gross domestic product caused by disasters including waterrelated disasters with a focus on protecting the poor and people in vulnerable situations,"['sustainable', 'number', 'number', 'affected', 'direct', 'economic', 'relative', 'global', 'gross', 'domestic', 'product', 'focus', 'poor', 'vulnerable']","['JJ', 'NN', 'NN', 'JJ', 'JJ', 'JJ', 'VBP', 'JJ', 'JJ', 'JJ', 'NN', 'NN', 'JJ', 'JJ']",4,1,9
T95G11,"By 2030, reduce the adverse per capita environmental impact of cities, including by paying special attention to air quality and municipal and other waste management",Sustainable Cities and Communities,sustainable cities and communities by  reduce the adverse per capita environmental impact of cities including by paying special attention to air quality and municipal and other waste management,"['sustainable', 'adverse', 'capita', 'environmental', 'impact', 'special', 'attention', 'air', 'quality', 'municipal', 'other', 'waste', 'management']","['JJ', 'JJ', 'JJ', 'JJ', 'NN', 'JJ', 'NN', 'NN', 'NN', 'JJ', 'JJ', 'NN', 'NN']",6,0,7
T96G11,"By 2030, provide universal access to safe, inclusive and accessible, green and public spaces, in particular for women and children, older persons and persons with disabilities",Sustainable Cities and Communities,sustainable cities and communities by  provide universal access to safe inclusive and accessible green and public spaces in particular for women and children older persons and persons with disabilities,"['sustainable', 'provide', 'universal', 'access', 'inclusive', 'accessible', 'green', 'public', 'particular']","['JJ', 'NN', 'JJ', 'NN', 'JJ', 'JJ', 'JJ', 'JJ', 'JJ']",2,0,7
T97G11,"Support positive economic, social and environmental links between urban, peri-urban and rural areas by strengthening national and regional development planning",Sustainable Cities and Communities,sustainable cities and communities support positive economic social and environmental links between urban periurban and rural areas by strengthening national and regional development planning,"['sustainable', 'support', 'positive', 'economic', 'social', 'environmental', 'urban', 'periurban', 'rural', 'national', 'regional', 'development', 'planning']","['JJ', 'VBP', 'JJ', 'JJ', 'JJ', 'JJ', 'JJ', 'NN', 'JJ', 'JJ', 'JJ', 'NN', 'NN']",3,1,9
T98G11,"By 2020, substantially increase the number of cities and human settlements adopting and implementing integrated policies and plans towards inclusion, resource efficiency, mitigation and adaptation to climate change, resilience to disasters, and develop and implement, in line with the Sendai Framework for Disaster Risk Reduction 2015-2030, holistic disaster risk management at all levels",Sustainable Cities and Communities,sustainable cities and communities by  substantially increase the number of cities and human settlements adopting and implementing integrated policies and plans towards inclusion resource efficiency mitigation and adaptation to climate change resilience to disasters and develop and implement in line with the sendai framework for disaster risk reduction  holistic disaster risk management at all levels,"['sustainable', 'number', 'human', 'integrated', 'inclusion', 'resource', 'efficiency', 'mitigation', 'adaptation', 'change', 'resilience', 'line', 'sendai', 'framework', 'disaster', 'risk', 'reduction', 'holistic', 'disaster', 'risk', 'management']","['JJ', 'NN', 'JJ', 'JJ', 'NN', 'NN', 'NN', 'NN', 'NN', 'NN', 'NN', 'NN', 'NN', 'NN', 'NN', 'NN', 'NN', 'JJ', 'NN', 'NN', 'NN']",17,0,4
T99G11,"Support least developed countries, including through financial and technical assistance, in building sustainable and resilient buildings utilizing local materials",Sustainable Cities and Communities,sustainable cities and communities support least developed countries including through financial and technical assistance in building sustainable and resilient buildings utilizing local materials,"['sustainable', 'support', 'developed', 'financial', 'technical', 'assistance', 'building', 'sustainable', 'resilient', 'local']","['JJ', 'VBP', 'JJ', 'JJ', 'JJ', 'NN', 'NN', 'JJ', 'JJ', 'JJ']",2,1,7
T100G12,"Implement the 10-year framework of programmes on sustainable consumption and production, all countries taking action, with developed countries taking the lead, taking into account the development and capabilities of developing countries",Responsible Consumption and Production,responsible consumption and production implement the year framework of programmes on sustainable consumption and production all countries taking action with developed countries taking the lead taking into account the development and capabilities of developing countries,"['responsible', 'consumption', 'production', 'implement', 'year', 'framework', 'sustainable', 'consumption', 'production', 'action', 'developed', 'lead', 'account', 'development']","['JJ', 'NN', 'NN', 'NN', 'NN', 'NN', 'JJ', 'NN', 'NN', 'NN', 'JJ', 'NN', 'NN', 'NN']",11,0,3
T101G12,"By 2030, achieve the sustainable management and efficient use of natural resources",Responsible Consumption and Production,responsible consumption and production by  achieve the sustainable management and efficient use of natural resources,"['responsible', 'consumption', 'production', 'sustainable', 'management', 'efficient', 'use', 'natural']","['JJ', 'NN', 'NN', 'JJ', 'NN', 'JJ', 'NN', 'JJ']",4,0,4
T102G12,"By 2030, halve per capita global food waste at the retail and consumer levels and reduce food losses along production and supply chains, including post-harvest losses",Responsible Consumption and Production,responsible consumption and production by  halve per capita global food waste at the retail and consumer levels and reduce food losses along production and supply chains including postharvest losses,"['responsible', 'consumption', 'production', 'halve', 'capita', 'global', 'food', 'waste', 'retail', 'consumer', 'food', 'production', 'supply', 'postharvest']","['JJ', 'NN', 'NN', 'NN', 'NN', 'JJ', 'NN', 'NN', 'JJ', 'NN', 'NN', 'NN', 'NN', 'NN']",11,0,3
T103G12,"By 2020, achieve the environmentally sound management of chemicals and all wastes throughout their life cycle, in accordance with agreed international frameworks, and significantly reduce their release to air, water and soil in order to minimize their adverse impacts on human health and the environment",Responsible Consumption and Production,responsible consumption and production by  achieve the environmentally sound management of chemicals and all wastes throughout their life cycle in accordance with agreed international frameworks and significantly reduce their release to air water and soil in order to minimize their adverse impacts on human health and the environment,"['responsible', 'consumption', 'production', 'sound', 'management', 'life', 'cycle', 'accordance', 'agreed', 'international', 'release', 'air', 'water', 'soil', 'order', 'adverse', 'human', 'health', 'environment']","['JJ', 'NN', 'NN', 'JJ', 'NN', 'NN', 'NN', 'NN', 'JJ', 'JJ', 'NN', 'NN', 'NN', 'NN', 'NN', 'JJ', 'JJ', 'NN', 'NN']",13,0,6
T104G12,"By 2030, substantially reduce waste generation through prevention, reduction, recycling and reuse",Responsible Consumption and Production,responsible consumption and production by  substantially reduce waste generation through prevention reduction recycling and reuse,"['responsible', 'consumption', 'production', 'waste', 'generation', 'prevention', 'reduction', 'recycling', 'reuse']","['JJ', 'NN', 'NN', 'NN', 'NN', 'NN', 'NN', 'NN', 'NN']",8,0,1
T105G12,"Encourage companies, especially large and transnational companies, to adopt sustainable practices and to integrate sustainability information into their reporting cycle",Responsible Consumption and Production,responsible consumption and production encourage companies especially large and transnational companies to adopt sustainable practices and to integrate sustainability information into their reporting cycle,"['responsible', 'consumption', 'production', 'encourage', 'large', 'transnational', 'sustainable', 'sustainability', 'information', 'reporting', 'cycle']","['JJ', 'NN', 'NN', 'NN', 'JJ', 'JJ', 'JJ', 'NN', 'NN', 'NN', 'NN']",7,0,4
T106G12,"Promote public procurement practices that are sustainable, in accordance with national policies and priorities",Responsible Consumption and Production,responsible consumption and production promote public procurement practices that are sustainable in accordance with national policies and priorities,"['responsible', 'consumption', 'production', 'promote', 'public', 'procurement', 'are', 'sustainable', 'accordance', 'national']","['JJ', 'NN', 'NN', 'VBP', 'JJ', 'NN', 'VBP', 'JJ', 'NN', 'JJ']",4,2,4
