id,target,sdg,text,sentence,word_types,nouns,verbs,adjectives
T34G4,"By 2030, ensure that all learners acquire the knowledge and skills needed to promote sustainable development, including, among others, through education for sustainable development and sustainable lifestyles, human rights, gender equality, promotion of a culture of peace and non-violence, global citizenship and appreciation of cultural diversity and of culture’s contribution to sustainable development",Quality Education,quality education by  ensure that all learners acquire the knowledge and skills needed to promote sustainable development including among others through education for sustainable development and sustainable lifestyles human rights gender equality promotion of a culture of peace and nonviolence global citizenship and appreciation of cultural diversity and of culture’s contribution to sustainable development,"['quality', 'education', 'knowledge', 'sustainable', 'development', 'education', 'sustainable', 'development', 'sustainable', 'human', 'gender', 'equality', 'promotion', 'culture', 'peace', 'nonviolence', 'global', 'citizenship', 'appreciation', 'cultural', 'diversity', 'culture', 'contribution', 'development']","['NN', 'NN', 'NN', 'JJ', 'NN', 'NN', 'JJ', 'NN', 'JJ', 'JJ', 'NN', 'NN', 'NN', 'NN', 'NN', 'NN', 'JJ', 'NN', 'NN', 'JJ', 'NN', 'NN', 'NN', 'NN']",18,0,6
T35G4,"Build and upgrade education facilities that are child, disability and gender sensitive and provide safe, nonviolent, inclusive and effective learning environments for all",Quality Education,quality education build and upgrade education facilities that are child disability and gender sensitive and provide safe nonviolent inclusive and effective learning environments for all,"['quality', 'education', 'build', 'upgrade', 'education', 'are', 'child', 'disability', 'sensitive', 'safe', 'nonviolent', 'inclusive', 'effective', 'learning']","['NN', 'NN', 'NN', 'JJ', 'NN', 'VBP', 'JJ', 'NN', 'JJ', 'JJ', 'JJ', 'NN', 'JJ', 'NN']",7,1,6
T36G4,"By 2020, substantially expand globally the number of scholarships available to developing countries, in particular least developed countries, small island developing States and African countries, for enrolment in higher education, including vocational training and information and communications technology, technical, engineering and scientific programmes, in developed countries and other developing countries",Quality Education,quality education by  substantially expand globally the number of scholarships available to developing countries in particular least developed countries small island developing states and african countries for enrolment in higher education including vocational training and information and communications technology technical engineering and scientific programmes in developed countries and other developing countries,"['quality', 'education', 'number', 'available', 'particular', 'developed', 'small', 'island', 'african', 'enrolment', 'education', 'vocational', 'training', 'information', 'technology', 'technical', 'engineering', 'scientific', 'developed', 'other']","['NN', 'NN', 'NN', 'JJ', 'JJ', 'JJ', 'JJ', 'VBP', 'JJ', 'NN', 'NN', 'JJ', 'NN', 'NN', 'NN', 'JJ', 'NN', 'JJ', 'JJ', 'JJ']",9,1,10
T37G4,"By 2030, substantially increase the supply of qualified teachers, including through international cooperation for teacher training in developing countries, especially least developed countries and small island developing states",Quality Education,quality education by  substantially increase the supply of qualified teachers including through international cooperation for teacher training in developing countries especially least developed countries and small island developing states,"['quality', 'education', 'supply', 'qualified', 'international', 'cooperation', 'teacher', 'training', 'developed', 'small', 'island']","['NN', 'NN', 'NN', 'JJ', 'JJ', 'NN', 'NN', 'NN', 'JJ', 'JJ', 'NN']",7,0,4
T38G5,End all forms of discrimination against all women and girls everywhere,Gender Equality,gender equality end all forms of discrimination against all women and girls everywhere,"['gender', 'equality', 'end', 'discrimination']","['NN', 'NN', 'VBP', 'NN']",3,1,0
T39G5,"Eliminate all forms of violence against all women and girls in the public and private spheres, including trafficking and sexual and other types of exploitation",Gender Equality,gender equality eliminate all forms of violence against all women and girls in the public and private spheres including trafficking and sexual and other types of exploitation,"['gender', 'equality', 'eliminate', 'violence', 'public', 'private', 'trafficking', 'sexual', 'other', 'exploitation']","['NN', 'NN', 'VBP', 'NN', 'JJ', 'JJ', 'NN', 'JJ', 'JJ', 'NN']",5,1,4
T40G5,"Eliminate all harmful practices, such as child, early and forced marriage and female genital mutilation",Gender Equality,gender equality eliminate all harmful practices such as child early and forced marriage and female genital mutilation,"['gender', 'equality', 'eliminate', 'harmful', 'such', 'child', 'early', 'forced', 'marriage', 'female', 'genital', 'mutilation']","['NN', 'NN', 'VBP', 'JJ', 'JJ', 'JJ', 'JJ', 'JJ', 'NN', 'JJ', 'JJ', 'NN']",4,1,7
T41G5,"Recognize and value unpaid care and domestic work through the provision of public services, infrastructure and social protection policies and the promotion of shared responsibility within the household and the family as nationally appropriate",Gender Equality,gender equality recognize and value unpaid care and domestic work through the provision of public services infrastructure and social protection policies and the promotion of shared responsibility within the household and the family as nationally appropriate,"['gender', 'equality', 'recognize', 'value', 'unpaid', 'care', 'domestic', 'work', 'provision', 'public', 'infrastructure', 'social', 'protection', 'promotion', 'responsibility', 'household', 'family', 'appropriate']","['NN', 'NN', 'NN', 'NN', 'JJ', 'NN', 'JJ', 'NN', 'NN', 'JJ', 'NN', 'JJ', 'NN', 'NN', 'NN', 'NN', 'NN', 'JJ']",13,0,5
T42G5,"Ensure women’s full and effective participation and equal opportunities for leadership at all levels of decision making in political, economic and public life",Gender Equality,gender equality ensure women’s full and effective participation and equal opportunities for leadership at all levels of decision making in political economic and public life,"['gender', 'equality', 's', 'full', 'effective', 'participation', 'equal', 'leadership', 'decision', 'making', 'political', 'economic', 'public', 'life']","['NN', 'NN', 'JJ', 'JJ', 'JJ', 'NN', 'JJ', 'NN', 'NN', 'NN', 'JJ', 'JJ', 'JJ', 'NN']",7,0,7
T43G5,Ensure universal access to sexual and reproductive health and reproductive rights as agreed in accordance with the Programme of Action of the International Conference on Population and Development and the Beijing Platform for Action and the outcome documents of their review conferences,Gender Equality,gender equality ensure universal access to sexual and reproductive health and reproductive rights as agreed in accordance with the programme of action of the international conference on population and development and the beijing platform for action and the outcome documents of their review conferences,"['gender', 'equality', 'universal', 'access', 'sexual', 'reproductive', 'health', 'reproductive', 'accordance', 'programme', 'action', 'international', 'conference', 'population', 'development', 'beijing', 'platform', 'action', 'outcome', 'review']","['NN', 'NN', 'JJ', 'NN', 'JJ', 'JJ', 'NN', 'JJ', 'NN', 'NN', 'NN', 'JJ', 'NN', 'NN', 'NN', 'NN', 'NN', 'NN', 'NN', 'NN']",15,0,5
T44G5,"Undertake reforms to give women equal rights to economic resources, as well as access to ownership and control over land and other forms of property, financial services, inheritance and natural resources, in accordance with national laws",Gender Equality,gender equality undertake reforms to give women equal rights to economic resources as well as access to ownership and control over land and other forms of property financial services inheritance and natural resources in accordance with national laws,"['gender', 'equality', 'undertake', 'equal', 'economic', 'access', 'ownership', 'control', 'land', 'other', 'property', 'financial', 'inheritance', 'natural', 'accordance', 'national']","['NN', 'NN', 'VBP', 'JJ', 'JJ', 'NN', 'NN', 'NN', 'NN', 'JJ', 'NN', 'JJ', 'NN', 'JJ', 'NN', 'JJ']",9,1,6
T45G5,"Enhance the use of enabling technology, in particular information and communications technology, to promote the empowerment of women",Gender Equality,gender equality enhance the use of enabling technology in particular information and communications technology to promote the empowerment of women,"['gender', 'equality', 'use', 'technology', 'particular', 'information', 'technology', 'empowerment']","['NN', 'NN', 'NN', 'NN', 'JJ', 'NN', 'NN', 'NN']",7,0,1
T46G5,Adopt and strengthen sound policies and enforceable legislation for the promotion of gender equality and the empowerment of all women and girls at all levels,Gender Equality,gender equality adopt and strengthen sound policies and enforceable legislation for the promotion of gender equality and the empowerment of all women and girls at all levels,"['gender', 'equality', 'adopt', 'sound', 'enforceable', 'legislation', 'promotion', 'gender', 'equality', 'empowerment']","['NN', 'NN', 'NN', 'JJ', 'JJ', 'NN', 'NN', 'NN', 'NN', 'NN']",8,0,2
T47G6,"By 2030, achieve universal and equitable access to safe and affordable drinking water for all",Clean Water and Sanitation,clean water and sanitation by  achieve universal and equitable access to safe and affordable drinking water for all,"['clean', 'water', 'sanitation', 'achieve', 'universal', 'equitable', 'access', 'affordable', 'drinking', 'water']","['JJ', 'NN', 'NN', 'JJ', 'NN', 'JJ', 'NN', 'JJ', 'NN', 'NN']",6,0,4
T48G6,"By 2030, achieve access to adequate and equitable sanitation and hygiene for all and end open defecation, paying special attention to the needs of women and girls and those in vulnerable situations",Clean Water and Sanitation,clean water and sanitation by  achieve access to adequate and equitable sanitation and hygiene for all and end open defecation paying special attention to the needs of women and girls and those in vulnerable situations,"['clean', 'water', 'sanitation', 'achieve', 'access', 'equitable', 'sanitation', 'hygiene', 'open', 'defecation', 'special', 'attention', 'vulnerable']","['JJ', 'NN', 'NN', 'JJ', 'NN', 'JJ', 'NN', 'NN', 'JJ', 'NN', 'JJ', 'NN', 'JJ']",7,0,6
T49G6,"By 2030, improve water quality by reducing pollution, eliminating dumping and minimizing release of hazardous chemicals and materials, halving the proportion of untreated wastewater and substantially increasing recycling and safe reuse globally",Clean Water and Sanitation,clean water and sanitation by  improve water quality by reducing pollution eliminating dumping and minimizing release of hazardous chemicals and materials halving the proportion of untreated wastewater and substantially increasing recycling and safe reuse globally,"['clean', 'water', 'sanitation', 'improve', 'water', 'quality', 'pollution', 'dumping', 'release', 'hazardous', 'proportion', 'untreated', 'wastewater', 'safe', 'reuse']","['JJ', 'NN', 'NN', 'JJ', 'NN', 'NN', 'NN', 'NN', 'NN', 'JJ', 'NN', 'JJ', 'NN', 'JJ', 'NN']",10,0,5
T50G6,"By 2030, substantially increase water-use efficiency across all sectors and ensure sustainable withdrawals and supply of freshwater to address water scarcity and substantially reduce the number of people suffering from water scarcity",Clean Water and Sanitation,clean water and sanitation by  substantially increase wateruse efficiency across all sectors and ensure sustainable withdrawals and supply of freshwater to address water scarcity and substantially reduce the number of people suffering from water scarcity,"['clean', 'water', 'sanitation', 'wateruse', 'efficiency', 'sustainable', 'supply', 'freshwater', 'water', 'scarcity', 'number', 'water', 'scarcity']","['JJ', 'NN', 'NN', 'NN', 'NN', 'JJ', 'NN', 'NN', 'NN', 'NN', 'NN', 'NN', 'NN']",11,0,2
T51G6,"By 2030, implement integrated water resources management at all levels, including through transboundary cooperation as appropriate",Clean Water and Sanitation,clean water and sanitation by  implement integrated water resources management at all levels including through transboundary cooperation as appropriate,"['clean', 'water', 'sanitation', 'implement', 'integrated', 'water', 'management', 'transboundary', 'cooperation', 'appropriate']","['JJ', 'NN', 'NN', 'NN', 'JJ', 'NN', 'NN', 'JJ', 'NN', 'NN']",7,0,3
T52G6,"By 2020, protect and restore water-related ecosystems, including mountains, forests, wetlands, rivers, aquifers and lakes",Clean Water and Sanitation,clean water and sanitation by  protect and restore waterrelated ecosystems including mountains forests wetlands rivers aquifers and lakes,"['clean', 'water', 'sanitation', 'protect', 'restore', 'wetlands']","['JJ', 'NN', 'NN', 'NN', 'NN', 'VBP']",4,1,1
T53G6,"By 2030, expand international cooperation and capacity-building support to developing countries in water- and sanitation-related activities and programmes, including water harvesting, desalination, water efficiency, wastewater treatment, recycling and reuse technologies",Clean Water and Sanitation,clean water and sanitation by  expand international cooperation and capacitybuilding support to developing countries in water and sanitationrelated activities and programmes including water harvesting desalination water efficiency wastewater treatment recycling and reuse technologies,"['clean', 'water', 'sanitation', 'expand', 'international', 'cooperation', 'support', 'water', 'sanitationrelated', 'water', 'desalination', 'water', 'efficiency', 'wastewater', 'treatment', 'reuse']","['JJ', 'NN', 'NN', 'JJ', 'JJ', 'NN', 'NN', 'NN', 'JJ', 'NN', 'NN', 'NN', 'NN', 'NN', 'NN', 'NN']",12,0,4
T54G6,Support and strengthen the participation of local communities in improving water and sanitation management,Clean Water and Sanitation,clean water and sanitation support and strengthen the participation of local communities in improving water and sanitation management,"['clean', 'water', 'sanitation', 'support', 'participation', 'local', 'water', 'sanitation', 'management']","['JJ', 'NN', 'NN', 'NN', 'NN', 'JJ', 'NN', 'NN', 'NN']",7,0,2
T55G7,"By 2030, ensure universal access to affordable, reliable and modern energy services",Affordable and Clean Energy,affordable and clean energy by  ensure universal access to affordable reliable and modern energy services,"['affordable', 'clean', 'energy', 'universal', 'access', 'reliable', 'modern', 'energy']","['JJ', 'JJ', 'NN', 'JJ', 'NN', 'JJ', 'JJ', 'NN']",3,0,5
T56G7,"By 2030, increase substantially the share of renewable energy in the global energy mix",Affordable and Clean Energy,affordable and clean energy by  increase substantially the share of renewable energy in the global energy mix,"['affordable', 'clean', 'energy', 'increase', 'share', 'renewable', 'energy', 'global', 'energy', 'mix']","['JJ', 'JJ', 'NN', 'NN', 'NN', 'JJ', 'NN', 'JJ', 'NN', 'NN']",6,0,4
T57G7,"By 2030, double the global rate of improvement in energy efficiency",Affordable and Clean Energy,affordable and clean energy by  double the global rate of improvement in energy efficiency,"['affordable', 'clean', 'energy', 'double', 'global', 'rate', 'improvement', 'energy', 'efficiency']","['JJ', 'JJ', 'NN', 'JJ', 'JJ', 'NN', 'NN', 'NN', 'NN']",5,0,4
T58G7,"By 2030, enhance international cooperation to facilitate access to clean energy research and technology, including renewable energy, energy efficiency and advanced and cleaner fossil-fuel technology, and promote investment in energy infrastructure and clean energy technology",Affordable and Clean Energy,affordable and clean energy by  enhance international cooperation to facilitate access to clean energy research and technology including renewable energy energy efficiency and advanced and cleaner fossilfuel technology and promote investment in energy infrastructure and clean energy technology,"['affordable', 'clean', 'energy', 'enhance', 'international', 'cooperation', 'access', 'energy', 'research', 'technology', 'renewable', 'energy', 'energy', 'efficiency', 'advanced', 'fossilfuel', 'technology', 'investment', 'energy', 'infrastructure', 'clean', 'energy', 'technology']","['JJ', 'JJ', 'NN', 'JJ', 'JJ', 'NN', 'NN', 'NN', 'NN', 'NN', 'JJ', 'NN', 'NN', 'NN', 'JJ', 'NN', 'NN', 'NN', 'NN', 'NN', 'JJ', 'NN', 'NN']",16,0,7
T59G7,"By 2030, expand infrastructure and upgrade technology for supplying modern and sustainable energy services for all in developing countries, in particular least developed countries, small island developing States, and land-locked developing countries, in accordance with their respective programmes of support",Affordable and Clean Energy,affordable and clean energy by  expand infrastructure and upgrade technology for supplying modern and sustainable energy services for all in developing countries in particular least developed countries small island developing states and landlocked developing countries in accordance with their respective programmes of support,"['affordable', 'clean', 'energy', 'expand', 'infrastructure', 'upgrade', 'technology', 'modern', 'sustainable', 'energy', 'particular', 'developed', 'small', 'island', 'accordance', 'respective', 'support']","['JJ', 'JJ', 'NN', 'NN', 'NN', 'JJ', 'NN', 'JJ', 'JJ', 'NN', 'JJ', 'JJ', 'JJ', 'VBP', 'NN', 'JJ', 'NN']",7,1,9
T60G8,"Sustain per capita economic growth in accordance with national circumstances and, in particular, at least 7 per cent gross domestic product growth per annum in the least developed countries",Decent Work and Economic Growth,decent work and economic growth sustain per capita economic growth in accordance with national circumstances and in particular at least  per cent gross domestic product growth per annum in the least developed countries,"['decent', 'work', 'economic', 'growth', 'sustain', 'economic', 'growth', 'accordance', 'national', 'particular', 'cent', 'gross', 'domestic', 'product', 'growth', 'annum', 'developed']","['JJ', 'NN', 'JJ', 'NN', 'VBP', 'JJ', 'NN', 'NN', 'JJ', 'JJ', 'NN', 'JJ', 'JJ', 'NN', 'NN', 'NN', 'JJ']",8,1,8
T61G8,"Achieve higher levels of economic productivity through diversification, technological upgrading and innovation, including through a focus on high-value added and labour-intensive sectors",Decent Work and Economic Growth,decent work and economic growth achieve higher levels of economic productivity through diversification technological upgrading and innovation including through a focus on highvalue added and labourintensive sectors,"['decent', 'work', 'economic', 'growth', 'achieve', 'economic', 'productivity', 'diversification', 'technological', 'upgrading', 'innovation', 'focus', 'highvalue', 'labourintensive']","['JJ', 'NN', 'JJ', 'NN', 'VBP', 'JJ', 'NN', 'NN', 'JJ', 'NN', 'NN', 'NN', 'NN', 'JJ']",8,1,5
T62G8,"Promote development-oriented policies that support productive activities, decent job creation, entrepreneurship, creativity and innovation, and encourage the formalization and growth of micro-, small- and medium-sized enterprises, including through access to financial services",Decent Work and Economic Growth,decent work and economic growth promote developmentoriented policies that support productive activities decent job creation entrepreneurship creativity and innovation and encourage the formalization and growth of micro small and mediumsized enterprises including through access to financial services,"['decent', 'work', 'economic', 'growth', 'promote', 'support', 'productive', 'decent', 'job', 'creation', 'entrepreneurship', 'creativity', 'innovation', 'formalization', 'growth', 'micro', 'small', 'mediumsized', 'access', 'financial']","['JJ', 'NN', 'JJ', 'NN', 'NN', 'NN', 'JJ', 'JJ', 'NN', 'NN', 'NN', 'NN', 'NN', 'NN', 'NN', 'NN', 'JJ', 'JJ', 'NN', 'JJ']",13,0,7
T63G8,"Improve progressively, through 2030, global resource efficiency in consumption and production and endeavour to decouple economic growth from environmental degradation, in accordance with the 10-year framework of programmes on sustainable consumption and production, with developed countries taking the lead",Decent Work and Economic Growth,decent work and economic growth improve progressively through  global resource efficiency in consumption and production and endeavour to decouple economic growth from environmental degradation in accordance with the year framework of programmes on sustainable consumption and production with developed countries taking the lead,"['decent', 'work', 'economic', 'growth', 'improve', 'global', 'resource', 'efficiency', 'consumption', 'production', 'endeavour', 'economic', 'growth', 'environmental', 'degradation', 'accordance', 'year', 'framework', 'sustainable', 'consumption', 'production', 'developed', 'lead']","['JJ', 'NN', 'JJ', 'NN', 'VBP', 'JJ', 'NN', 'NN', 'NN', 'NN', 'NN', 'JJ', 'NN', 'JJ', 'NN', 'NN', 'NN', 'NN', 'JJ', 'NN', 'NN', 'JJ', 'NN']",15,1,7
T64G8,"By 2030, achieve full and productive employment and decent work for all women and men, including for young people and persons with disabilities, and equal pay for work of equal value",Decent Work and Economic Growth,decent work and economic growth by  achieve full and productive employment and decent work for all women and men including for young people and persons with disabilities and equal pay for work of equal value,"['decent', 'work', 'economic', 'growth', 'full', 'productive', 'employment', 'decent', 'work', 'young', 'equal', 'pay', 'work', 'equal', 'value']","['JJ', 'NN', 'JJ', 'NN', 'JJ', 'JJ', 'NN', 'JJ', 'NN', 'JJ', 'JJ', 'NN', 'NN', 'JJ', 'NN']",7,0,8
T65G8,"By 2020, substantially reduce the proportion of youth not in employment, education or training",Decent Work and Economic Growth,decent work and economic growth by  substantially reduce the proportion of youth not in employment education or training,"['decent', 'work', 'economic', 'growth', 'proportion', 'youth', 'employment', 'education', 'training']","['JJ', 'NN', 'JJ', 'NN', 'NN', 'NN', 'NN', 'NN', 'NN']",7,0,2
T66G8,"Take immediate and effective measures to eradicate forced labour, end modern slavery and human trafficking and secure the prohibition and elimination of the worst forms of child labour, including recruitment and use of child soldiers, and by 2025 end child labour in all its forms",Decent Work and Economic Growth,decent work and economic growth take immediate and effective measures to eradicate forced labour end modern slavery and human trafficking and secure the prohibition and elimination of the worst forms of child labour including recruitment and use of child soldiers and by  end child labour in all its forms,"['decent', 'work', 'economic', 'growth', 'immediate', 'effective', 'labour', 'end', 'modern', 'slavery', 'human', 'trafficking', 'prohibition', 'elimination', 'child', 'labour', 'recruitment', 'use', 'child', 'end', 'child', 'labour']","['JJ', 'NN', 'JJ', 'NN', 'JJ', 'JJ', 'JJ', 'NN', 'JJ', 'NN', 'JJ', 'NN', 'NN', 'NN', 'JJ', 'JJ', 'NN', 'NN', 'NN', 'NN', 'NN', 'NN']",13,0,9
T67G8,"Protect labour rights and promote safe and secure working environments for all workers, including migrant workers, in particular women migrants, and those in precarious employment",Decent Work and Economic Growth,decent work and economic growth protect labour rights and promote safe and secure working environments for all workers including migrant workers in particular women migrants and those in precarious employment,"['decent', 'work', 'economic', 'growth', 'protect', 'labour', 'promote', 'safe', 'secure', 'working', 'migrant', 'particular', 'precarious', 'employment']","['JJ', 'NN', 'JJ', 'NN', 'VBP', 'NN', 'NN', 'JJ', 'JJ', 'NN', 'JJ', 'JJ', 'JJ', 'NN']",6,1,7
T68G8,"By 2030, devise and implement policies to promote sustainable tourism that creates jobs and promotes local culture and products",Decent Work and Economic Growth,decent work and economic growth by  devise and implement policies to promote sustainable tourism that creates jobs and promotes local culture and products,"['decent', 'work', 'economic', 'growth', 'devise', 'implement', 'sustainable', 'tourism', 'local', 'culture']","['JJ', 'NN', 'JJ', 'NN', 'NN', 'JJ', 'JJ', 'NN', 'JJ', 'NN']",5,0,5
T69G8,"Strengthen the capacity of domestic financial institutions to encourage and expand access to banking, insurance and financial services for all",Decent Work and Economic Growth,decent work and economic growth strengthen the capacity of domestic financial institutions to encourage and expand access to banking insurance and financial services for all,"['decent', 'work', 'economic', 'growth', 'strengthen', 'capacity', 'domestic', 'financial', 'access', 'banking', 'insurance', 'financial']","['JJ', 'NN', 'JJ', 'NN', 'VBP', 'NN', 'JJ', 'JJ', 'NN', 'NN', 'NN', 'JJ']",6,1,5
T70G8,"Increase Aid for Trade support for developing countries, in particular least developed countries, including through the Enhanced Integrated Framework for Trade-Related Technical Assistance to Least Developed Countries",Decent Work and Economic Growth,decent work and economic growth increase aid for trade support for developing countries in particular least developed countries including through the enhanced integrated framework for traderelated technical assistance to least developed countries,"['decent', 'work', 'economic', 'growth', 'increase', 'aid', 'trade', 'support', 'particular', 'developed', 'integrated', 'framework', 'traderelated', 'technical', 'assistance', 'developed']","['JJ', 'NN', 'JJ', 'NN', 'NN', 'NN', 'NN', 'NN', 'JJ', 'JJ', 'JJ', 'NN', 'JJ', 'JJ', 'NN', 'JJ']",8,0,8
