id,target,sdg,text,sentence,word_types,nouns,verbs,adjectives
T1G1,"By 2030, eradicate extreme poverty for all people everywhere, currently measured as people living on less than $1.25 a day.",no poverty,no poverty by  eradicate extreme poverty for all people everywhere currently measured as people living on less than  a day,"['poverty', 'eradicate', 'extreme', 'poverty', 'day']","['NN', 'JJ', 'JJ', 'NN', 'NN']",3,0,2
T2G1,"By 2030, reduce at least by half the proportion of men, women and children of all ages living in poverty in all its dimensions according to national definitions.",no poverty,no poverty by  reduce at least by half the proportion of men women and children of all ages living in poverty in all its dimensions according to national definitions,"['poverty', 'proportion', 'poverty', 'national']","['NN', 'NN', 'NN', 'JJ']",3,0,1
T3G1,"Implement nationally appropriate social protection systems and measures for all, including floors, and by 2030 achieve substantial coverage of the poor and the vulnerable.",no poverty,no poverty implement nationally appropriate social protection systems and measures for all including floors and by  achieve substantial coverage of the poor and the vulnerable,"['poverty', 'implement', 'appropriate', 'social', 'protection', 'achieve', 'substantial', 'coverage', 'poor', 'vulnerable']","['NN', 'NN', 'JJ', 'JJ', 'NN', 'VBP', 'JJ', 'NN', 'JJ', 'JJ']",4,1,5
T4G1,"By 2030, ensure that all men and women, in particular the poor and the vulnerable, have equal rights to economic resources, as well as access to basic services, ownership and control over land and other forms of 13 property, inheritance, natural resources, appropriate new technology and financial services, including micro-finance.",no poverty,no poverty by  ensure that all men and women in particular the poor and the vulnerable have equal rights to economic resources as well as access to basic services ownership and control over land and other forms of  property inheritance natural resources appropriate new technology and financial services including microfinance,"['poverty', 'particular', 'poor', 'vulnerable', 'have', 'equal', 'economic', 'access', 'ownership', 'control', 'land', 'other', 'property', 'inheritance', 'natural', 'appropriate', 'new', 'technology', 'financial', 'microfinance']","['NN', 'JJ', 'JJ', 'JJ', 'VBP', 'JJ', 'JJ', 'NN', 'NN', 'NN', 'NN', 'JJ', 'NN', 'NN', 'JJ', 'VBP', 'JJ', 'NN', 'JJ', 'NN']",9,2,9
T5G1,"By 2030, build the resilience of the poor and those in vulnerable situations and reduce their exposure and vulnerability to climate-related extreme events and other economic, social and environmental shocks and disasters.",no poverty,no poverty by  build the resilience of the poor and those in vulnerable situations and reduce their exposure and vulnerability to climaterelated extreme events and other economic social and environmental shocks and disasters,"['poverty', 'resilience', 'poor', 'vulnerable', 'exposure', 'vulnerability', 'extreme', 'other', 'economic', 'social', 'environmental']","['NN', 'NN', 'JJ', 'JJ', 'NN', 'NN', 'JJ', 'JJ', 'JJ', 'JJ', 'JJ']",4,0,7
T6G1,"Ensure significant mobilization of resources from a variety of sources, including through enhanced development cooperation, in order to provide adequate and predictable means for developing countries, in particular least developed countries, to implement programmes and policies to end poverty in all its dimensions.",no poverty,no poverty ensure significant mobilization of resources from a variety of sources including through enhanced development cooperation in order to provide adequate and predictable means for developing countries in particular least developed countries to implement programmes and policies to end poverty in all its dimensions,"['poverty', 'significant', 'mobilization', 'variety', 'development', 'cooperation', 'order', 'adequate', 'predictable', 'particular', 'developed', 'poverty']","['NN', 'JJ', 'NN', 'NN', 'NN', 'NN', 'NN', 'JJ', 'JJ', 'JJ', 'JJ', 'NN']",7,0,5
T7G1,"Create sound policy frameworks at the national, regional and international levels, based on pro-poor and gender-sensitive development strategies, to support accelerated investment in poverty eradication actions",no poverty,no poverty create sound policy frameworks at the national regional and international levels based on propoor and gendersensitive development strategies to support accelerated investment in poverty eradication actions,"['poverty', 'sound', 'policy', 'national', 'regional', 'international', 'propoor', 'gendersensitive', 'development', 'accelerated', 'investment', 'poverty', 'eradication']","['NN', 'JJ', 'NN', 'JJ', 'JJ', 'JJ', 'NN', 'JJ', 'NN', 'JJ', 'NN', 'NN', 'NN']",7,0,6
T8G2,"By 2030, end hunger and ensure access by all people, in particular the poor and people in vulnerable situations, including infants, to safe, nutritious and sufficient food all year round.",Zero Hunger,zero hunger by  end hunger and ensure access by all people in particular the poor and people in vulnerable situations including infants to safe nutritious and sufficient food all year round,"['zero', 'hunger', 'end', 'hunger', 'access', 'particular', 'poor', 'vulnerable', 'nutritious', 'sufficient', 'food', 'year', 'round']","['NN', 'NN', 'NN', 'NN', 'NN', 'JJ', 'JJ', 'JJ', 'JJ', 'JJ', 'NN', 'NN', 'NN']",8,0,5
T9G2,"By 2030, end all forms of malnutrition, including achieving, by 2025, the internationally agreed targets on stunting and wasting in children under 5 years of age, and address the nutritional needs of adolescent girls, pregnant and lactating women and older persons",Zero Hunger,zero hunger by  end all forms of malnutrition including achieving by  the internationally agreed targets on stunting and wasting in children under  years of age and address the nutritional needs of adolescent girls pregnant and lactating women and older persons,"['zero', 'hunger', 'end', 'malnutrition', 'age', 'nutritional', 'adolescent', 'pregnant', 'lactating']","['NN', 'NN', 'NN', 'NN', 'NN', 'JJ', 'JJ', 'JJ', 'JJ']",5,0,4
T10G2,"By 2030, double the agricultural productivity and incomes of small-scale food producers, in particular women, indigenous peoples, family farmers, pastoralists and fishers, including through secure and equal access to land, other productive resources and inputs, knowledge, financial services, markets and opportunities for value addition and non-farm employment",Zero Hunger,zero hunger by  double the agricultural productivity and incomes of smallscale food producers in particular women indigenous peoples family farmers pastoralists and fishers including through secure and equal access to land other productive resources and inputs knowledge financial services markets and opportunities for value addition and nonfarm employment,"['zero', 'hunger', 'double', 'agricultural', 'productivity', 'smallscale', 'food', 'particular', 'indigenous', 'family', 'secure', 'equal', 'access', 'other', 'productive', 'knowledge', 'financial', 'value', 'addition', 'nonfarm', 'employment']","['NN', 'NN', 'JJ', 'JJ', 'NN', 'JJ', 'NN', 'JJ', 'JJ', 'NN', 'NN', 'JJ', 'NN', 'JJ', 'JJ', 'VBP', 'JJ', 'NN', 'NN', 'JJ', 'NN']",10,1,10
T11G2,"By 2030, ensure sustainable food production systems and implement resilient agricultural practices that increase productivity and production, that help maintain ecosystems, that strengthen capacity for adaptation to climate change, extreme weather, drought, flooding and other disasters and that progressively improve land and soil quality",Zero Hunger,zero hunger by  ensure sustainable food production systems and implement resilient agricultural practices that increase productivity and production that help maintain ecosystems that strengthen capacity for adaptation to climate change extreme weather drought flooding and other disasters and that progressively improve land and soil quality,"['zero', 'hunger', 'sustainable', 'food', 'production', 'implement', 'resilient', 'agricultural', 'increase', 'productivity', 'production', 'help', 'strengthen', 'capacity', 'adaptation', 'change', 'extreme', 'weather', 'drought', 'flooding', 'other', 'land', 'soil', 'quality']","['NN', 'NN', 'JJ', 'NN', 'NN', 'JJ', 'JJ', 'JJ', 'VBP', 'NN', 'NN', 'NN', 'VBP', 'NN', 'NN', 'NN', 'NN', 'NN', 'NN', 'NN', 'JJ', 'NN', 'NN', 'NN']",17,2,5
T12G2,"By 2020, maintain the genetic diversity of seeds, cultivated plants and farmed and domesticated animals and their related wild species, including through soundly managed and diversified seed and plant banks at the national, regional and international levels, and promote access to and fair and equitable sharing of benefits arising from the utilization of genetic resources and associated traditional knowledge, as internationally agreed",Zero Hunger,zero hunger by  maintain the genetic diversity of seeds cultivated plants and farmed and domesticated animals and their related wild species including through soundly managed and diversified seed and plant banks at the national regional and international levels and promote access to and fair and equitable sharing of benefits arising from the utilization of genetic resources and associated traditional knowledge as internationally agreed,"['zero', 'hunger', 'maintain', 'genetic', 'diversity', 'related', 'wild', 'seed', 'plant', 'national', 'regional', 'international', 'access', 'fair', 'equitable', 'sharing', 'utilization', 'genetic', 'associated', 'traditional', 'knowledge']","['NN', 'NN', 'VBP', 'JJ', 'NN', 'JJ', 'JJ', 'NN', 'NN', 'JJ', 'JJ', 'JJ', 'NN', 'JJ', 'JJ', 'NN', 'NN', 'JJ', 'JJ', 'JJ', 'NN']",9,1,11
T13G2,"Increase investment, including through enhanced international cooperation, in rural infrastructure, agricultural research and extension services, technology development and plant and livestock gene banks in order to enhance agricultural productive capacity in developing countries, in particular least developed countriesCorrect and prevent trade restrictions and distortions in world agricultural markets, including through the parallel elimination of all forms of agricultural export subsidies and all export measures with equivalent effect, in accordance with the mandate of the Doha Development Round",Zero Hunger,zero hunger increase investment including through enhanced international cooperation in rural infrastructure agricultural research and extension services technology development and plant and livestock gene banks in order to enhance agricultural productive capacity in developing countries in particular least developed countriescorrect and prevent trade restrictions and distortions in world agricultural markets including through the parallel elimination of all forms of agricultural export subsidies and all export measures with equivalent effect in accordance with the mandate of the doha development round,"['hunger', 'increase', 'investment', 'international', 'cooperation', 'rural', 'infrastructure', 'agricultural', 'research', 'extension', 'technology', 'development', 'plant', 'livestock', 'gene', 'order', 'agricultural', 'productive', 'capacity', 'particular', 'developed', 'countriescorrect', 'prevent', 'trade', 'world', 'agricultural', 'parallel', 'elimination', 'agricultural', 'export', 'export', 'equivalent', 'effect', 'accordance', 'mandate', 'doha', 'development', 'round']","['NN', 'NN', 'NN', 'JJ', 'NN', 'JJ', 'NN', 'JJ', 'NN', 'NN', 'NN', 'NN', 'NN', 'NN', 'NN', 'NN', 'JJ', 'JJ', 'NN', 'JJ', 'JJ', 'NN', 'NN', 'NN', 'NN', 'JJ', 'JJ', 'NN', 'JJ', 'NN', 'NN', 'JJ', 'NN', 'NN', 'NN', 'NN', 'NN', 'NN']",27,0,11
T14G2,"Adopt measures to ensure the proper functioning of food commodity markets and their derivatives and facilitate timely access to market information, including on food reserves, in order to help limit extreme food price volatility",Zero Hunger,zero hunger adopt measures to ensure the proper functioning of food commodity markets and their derivatives and facilitate timely access to market information including on food reserves in order to help limit extreme food price volatility,"['zero', 'hunger', 'proper', 'functioning', 'food', 'commodity', 'timely', 'access', 'market', 'information', 'food', 'order', 'extreme', 'food', 'price', 'volatility']","['NN', 'NN', 'JJ', 'NN', 'NN', 'NN', 'JJ', 'NN', 'NN', 'NN', 'NN', 'NN', 'JJ', 'NN', 'NN', 'NN']",13,0,3
T15G3,"By 2030, reduce the global maternal mortality ratio to less than 70 per 100,000 live births",Good Health and Well-being,good health and wellbeing by  reduce the global maternal mortality ratio to less than  per  live births,"['good', 'health', 'wellbeing', 'global', 'maternal', 'mortality', 'ratio', 'live']","['JJ', 'NN', 'NN', 'JJ', 'JJ', 'NN', 'NN', 'JJ']",4,0,4
T16G3,"By 2030, end preventable deaths of newborns and children under 5 years of age, with all countries aiming to reduce neonatal mortality to at least as low as 12 per 1,000 live births and under-5 mortality to at least as low as 25 per 1,000 live births",Good Health and Well-being,good health and wellbeing by  end preventable deaths of newborns and children under  years of age with all countries aiming to reduce neonatal mortality to at least as low as  per  live births and under mortality to at least as low as  per  live births,"['good', 'health', 'wellbeing', 'end', 'preventable', 'age', 'neonatal', 'mortality', 'low', 'live', 'mortality', 'low', 'live']","['JJ', 'NN', 'NN', 'NN', 'JJ', 'NN', 'JJ', 'NN', 'JJ', 'JJ', 'NN', 'JJ', 'JJ']",6,0,7
T17G3,"By 2030, end the epidemics of AIDS, tuberculosis, malaria and neglected tropical diseases and combat hepatitis, water-borne diseases and other communicable diseases",Good Health and Well-being,good health and wellbeing by  end the epidemics of aids tuberculosis malaria and neglected tropical diseases and combat hepatitis waterborne diseases and other communicable diseases,"['good', 'health', 'wellbeing', 'end', 'tuberculosis', 'malaria', 'neglected', 'tropical', 'combat', 'hepatitis', 'waterborne', 'other', 'communicable']","['JJ', 'NN', 'NN', 'NN', 'NN', 'NN', 'JJ', 'JJ', 'NN', 'NN', 'NN', 'JJ', 'JJ']",8,0,5
T18G3,"By 2030, reduce by one third premature mortality from non-communicable diseases through prevention and treatment and promote mental health and well-being",Good Health and Well-being,good health and wellbeing by  reduce by one third premature mortality from noncommunicable diseases through prevention and treatment and promote mental health and wellbeing,"['good', 'health', 'wellbeing', 'third', 'premature', 'mortality', 'noncommunicable', 'prevention', 'treatment', 'promote', 'mental', 'health', 'wellbeing']","['JJ', 'NN', 'NN', 'JJ', 'NN', 'NN', 'JJ', 'NN', 'NN', 'JJ', 'JJ', 'NN', 'NN']",8,0,5
T19G3,"Strengthen the prevention and treatment of substance abuse, including narcotic drug abuse and harmful use of alcohol",Good Health and Well-being,good health and wellbeing strengthen the prevention and treatment of substance abuse including narcotic drug abuse and harmful use of alcohol,"['good', 'health', 'prevention', 'treatment', 'substance', 'abuse', 'narcotic', 'drug', 'abuse', 'harmful', 'use', 'alcohol']","['JJ', 'NN', 'NN', 'NN', 'NN', 'NN', 'JJ', 'NN', 'NN', 'JJ', 'NN', 'NN']",9,0,3
T20G3,"By 2020, halve the number of global deaths and injuries from road traffic accidents 3.7",Good Health and Well-being,good health and wellbeing by  halve the number of global deaths and injuries from road traffic accidents ,"['good', 'health', 'wellbeing', 'number', 'global', 'road', 'traffic']","['JJ', 'NN', 'NN', 'NN', 'JJ', 'NN', 'NN']",5,0,2
T21G3,"By 2030, ensure universal access to sexual and reproductive health-care services, including for family planning, information and education, and the integration of reproductive health into national strategies and programmes",Good Health and Well-being,good health and wellbeing by  ensure universal access to sexual and reproductive healthcare services including for family planning information and education and the integration of reproductive health into national strategies and programmes,"['good', 'health', 'wellbeing', 'universal', 'access', 'sexual', 'reproductive', 'healthcare', 'family', 'planning', 'information', 'education', 'integration', 'reproductive', 'health', 'national']","['JJ', 'NN', 'NN', 'JJ', 'NN', 'JJ', 'JJ', 'NN', 'NN', 'NN', 'NN', 'NN', 'NN', 'JJ', 'NN', 'JJ']",10,0,6
T22G3,"Achieve universal health coverage, including financial risk protection, access to quality essential health-care services and access to safe, effective, quality and affordable essential medicines and vaccines for all",Good Health and Well-being,good health and wellbeing achieve universal health coverage including financial risk protection access to quality essential healthcare services and access to safe effective quality and affordable essential medicines and vaccines for all,"['good', 'health', 'achieve', 'universal', 'health', 'coverage', 'financial', 'risk', 'protection', 'access', 'essential', 'healthcare', 'access', 'effective', 'quality', 'affordable', 'essential']","['JJ', 'NN', 'VBP', 'JJ', 'NN', 'NN', 'JJ', 'NN', 'NN', 'NN', 'JJ', 'NN', 'NN', 'JJ', 'NN', 'JJ', 'JJ']",9,1,7
T23G3,"By 2030, substantially reduce the number of deaths and illnesses from hazardous chemicals and air, water and soil pollution and contamination",Good Health and Well-being,good health and wellbeing by  substantially reduce the number of deaths and illnesses from hazardous chemicals and air water and soil pollution and contamination,"['good', 'health', 'wellbeing', 'number', 'hazardous', 'air', 'water', 'soil', 'pollution', 'contamination']","['JJ', 'NN', 'NN', 'NN', 'JJ', 'NN', 'NN', 'NN', 'NN', 'NN']",8,0,2
T24G3,"Strengthen the implementation of the World Health Organization Framework Convention on Tobacco Control in all countries, as appropriate",Good Health and Well-being,good health and wellbeing strengthen the implementation of the world health organization framework convention on tobacco control in all countries as appropriate,"['good', 'health', 'implementation', 'world', 'health', 'organization', 'framework', 'convention', 'tobacco', 'control', 'appropriate']","['JJ', 'NN', 'NN', 'NN', 'NN', 'NN', 'NN', 'NN', 'NN', 'NN', 'NN']",10,0,1
T25G3,"Support the research and development of vaccines and medicines for the communicable and noncommunicable diseases that primarily affect developing countries, provide access to affordable essential medicines and vaccines, in accordance with the Doha Declaration on the TRIPS Agreement and Public Health, which affirms the right of developing countries to use to the full the provisions in the Agreement on Trade Related Aspects of Intellectual Property Rights regarding flexibilities to protect public health, and, in particular, provide access to medicines for all",Good Health and Well-being,good health and wellbeing support the research and development of vaccines and medicines for the communicable and noncommunicable diseases that primarily affect developing countries provide access to affordable essential medicines and vaccines in accordance with the doha declaration on the trips agreement and public health which affirms the right of developing countries to use to the full the provisions in the agreement on trade related aspects of intellectual property rights regarding flexibilities to protect public health and in particular provide access to medicines for all,"['good', 'health', 'support', 'research', 'development', 'communicable', 'noncommunicable', 'affect', 'provide', 'access', 'affordable', 'essential', 'accordance', 'doha', 'declaration', 'agreement', 'public', 'health', 'right', 'full', 'agreement', 'trade', 'intellectual', 'property', 'public', 'health', 'particular', 'provide', 'access']","['JJ', 'NN', 'NN', 'NN', 'NN', 'JJ', 'JJ', 'VBP', 'VBP', 'NN', 'JJ', 'JJ', 'NN', 'NN', 'NN', 'NN', 'JJ', 'NN', 'NN', 'JJ', 'NN', 'NN', 'JJ', 'NN', 'JJ', 'NN', 'JJ', 'NN', 'NN']",17,2,10
T26G3,"Substantially increase health financing and the recruitment, development, training and retention of the health workforce in developing countries, especially in least developed countries and small island developing States",Good Health and Well-being,good health and wellbeing substantially increase health financing and the recruitment development training and retention of the health workforce in developing countries especially in least developed countries and small island developing states,"['good', 'health', 'health', 'financing', 'recruitment', 'development', 'training', 'retention', 'health', 'workforce', 'developed', 'small', 'island']","['JJ', 'NN', 'NN', 'NN', 'NN', 'NN', 'NN', 'NN', 'NN', 'NN', 'JJ', 'JJ', 'NN']",10,0,3
T27G3,"Strengthen the capacity of all countries, in particular developing countries, for early warning, risk reduction and management of national and global health risks",Good Health and Well-being,good health and wellbeing strengthen the capacity of all countries in particular developing countries for early warning risk reduction and management of national and global health risks,"['good', 'health', 'capacity', 'particular', 'early', 'warning', 'risk', 'reduction', 'management', 'national', 'global', 'health']","['JJ', 'NN', 'NN', 'JJ', 'JJ', 'NN', 'NN', 'NN', 'NN', 'JJ', 'JJ', 'NN']",7,0,5
T28G4,"By 2030, ensure that all girls and boys complete free, equitable and quality primary and secondary education leading to relevant and Goal-4 effective learning outcomes",Quality Education,quality education by  ensure that all girls and boys complete free equitable and quality primary and secondary education leading to relevant and goal effective learning outcomes,"['quality', 'education', 'complete', 'free', 'equitable', 'quality', 'primary', 'secondary', 'education', 'goal', 'effective', 'learning']","['NN', 'NN', 'JJ', 'JJ', 'NN', 'NN', 'NN', 'JJ', 'NN', 'NN', 'JJ', 'NN']",8,0,4
T29G4,"By 2030, ensure that all girls and boys have access to quality early childhood development, care and preprimary education so that they are ready for primary education",Quality Education,quality education by  ensure that all girls and boys have access to quality early childhood development care and preprimary education so that they are ready for primary education,"['quality', 'education', 'have', 'access', 'early', 'childhood', 'development', 'care', 'preprimary', 'education', 'are', 'ready', 'primary', 'education']","['NN', 'NN', 'VBP', 'NN', 'JJ', 'NN', 'NN', 'NN', 'JJ', 'NN', 'VBP', 'JJ', 'JJ', 'NN']",8,2,4
T30G4,"By 2030, ensure equal access for all women and men to affordable and quality technical, vocational and tertiary education, including university",Quality Education,quality education by  ensure equal access for all women and men to affordable and quality technical vocational and tertiary education including university,"['quality', 'education', 'equal', 'access', 'technical', 'vocational', 'tertiary', 'education', 'university']","['NN', 'NN', 'JJ', 'NN', 'JJ', 'NN', 'JJ', 'NN', 'NN']",6,0,3
T31G4,"By 2030, substantially increase the number of youth and adults who have relevant skills, including technical and vocational skills, for employment, decent jobs and entrepreneurship",Quality Education,quality education by  substantially increase the number of youth and adults who have relevant skills including technical and vocational skills for employment decent jobs and entrepreneurship,"['quality', 'education', 'number', 'youth', 'have', 'relevant', 'technical', 'vocational', 'employment', 'decent', 'entrepreneurship']","['NN', 'NN', 'NN', 'NN', 'VBP', 'JJ', 'JJ', 'JJ', 'NN', 'NN', 'NN']",7,1,3
T32G4,"By 2030, eliminate gender disparities in education and ensure equal access to all levels of education and vocational training for the vulnerable, including persons with disabilities, indigenous peoples and children in vulnerable situations",Quality Education,quality education by  eliminate gender disparities in education and ensure equal access to all levels of education and vocational training for the vulnerable including persons with disabilities indigenous peoples and children in vulnerable situations,"['quality', 'education', 'eliminate', 'gender', 'education', 'equal', 'access', 'education', 'vocational', 'training', 'vulnerable', 'indigenous', 'vulnerable']","['NN', 'NN', 'JJ', 'NN', 'NN', 'JJ', 'NN', 'NN', 'JJ', 'NN', 'JJ', 'JJ', 'JJ']",7,0,6
T33G4,"By 2030, ensure that all youth and a substantial proportion of adults, both men and women, achieve literacy and numeracy",Quality Education,quality education by  ensure that all youth and a substantial proportion of adults both men and women achieve literacy and numeracy,"['quality', 'education', 'youth', 'substantial', 'proportion', 'achieve', 'literacy', 'numeracy']","['NN', 'NN', 'NN', 'JJ', 'NN', 'VBP', 'NN', 'NN']",6,1,1
